{
  "$schema": "http://json-schema.org/draft-07/schema#",
  "$id": "https://example.com/chess-game.schema.json",
  "title": "Chess Game JSON Schema",
  "description": "Schema for chess games with moves, variations, and analysis",
  "type": "array",
  "items": {
    "type": "object",
    "properties": {
      "game_id": {
        "type": "string",
        "description": "Unique identifier for the game"
      },
      "metadata": {
        "type": "object",
        "properties": {
          "event": { "type": "string" },
          "site": { "type": "string" },
          "date": { "type": "string" },
          "round": { "type": "string" },
          "white": { "type": "string" },
          "black": { "type": "string" },
          "result": { "type": "string", "enum": ["1-0", "0-1", "1/2-1/2", "*"] },
          "time_control": { "type": "string" },
          "orientation": { "type": "string", "enum": ["white", "black"] },
          "whitetimecontrol": { "type": "string" },
          "blacktimecontrol": { "type": "string" },
          "fen": {
            "type": "string",
            "description": "Starting FEN position (optional, defaults to standard starting position)"
          }
        },
        "required": ["event", "site", "date", "white", "black", "result"]
      },
      "moves": {
        "type": "array",
        "items": {
          "$ref": "#/$defs/move"
        }
      },
      "notes": {
        "type": "string",
        "description": "Additional notes about the game"
      }
    },
    "required": ["game_id", "metadata", "moves"]
  },
  "$defs": {
    "move": {
      "type": "object",
      "properties": {
        "san": {
          "type": "string",
          "description": "Standard Algebraic Notation of the move"
        },
        "move_number": {
          "type": "integer",
          "minimum": 1,
          "description": "Move number in the game"
        },
        "color": {
          "type": "string",
          "enum": ["w", "b"],
          "description": "Color making the move"
        },
        "fen": {
          "type": "string",
          "description": "FEN representation of the board position after this move (optional)"
        },
        "annotations": {
          "type": "object",
          "properties": {
            "comment": { "type": "string" },
            "eval": { "type": "string" }
          }
        },
        "variations": {
          "type": "array",
          "items": {
            "type": "object",
            "properties": {
              "label": { "type": "string" },
              "line": {
                "type": "array",
                "items": { "$ref": "#/$defs/move" }
              }
            },
            "required": ["line"]
          }
        }
      },
      "required": ["san", "move_number", "color"]
    }
  }
}