[
  {
    "game_id": "Training_EC_2025.11.29_unknown_Stockfish_vs_SPN",
    "metadata": {
      "event": "Training",
      "site": "EC",
      "date": "2025.11.29",
      "round": "?",
      "white": "Stockfish",
      "black": "SPN",
      "result": "1-0",
      "orientation": "black",
      "time_control": "180+2"
    },
    "moves": [
      {
        "san": "d4",
        "move_number": 1,
        "color": "w",
        "lan": "d2d4",
        "annotations": {
          "comment": "[%clk 0:02:47.4]"
        },
        "variations": []
      },
      {
        "san": "g6",
        "move_number": 1,
        "color": "b",
        "lan": "g7g6",
        "annotations": {
          "comment": "[%clk 0:02:49.9]"
        },
        "variations": []
      },
      {
        "san": "e4",
        "move_number": 2,
        "color": "w",
        "lan": "e2e4",
        "annotations": {
          "comment": "[%clk 0:02:46.3]"
        },
        "variations": []
      },
      {
        "san": "c5",
        "move_number": 2,
        "color": "b",
        "lan": "c7c5",
        "annotations": {
          "comment": "[%clk 0:02:50.7]"
        },
        "variations": []
      },
      {
        "san": "dxc5",
        "move_number": 3,
        "color": "w",
        "lan": "d4c5",
        "annotations": {
          "comment": "[%clk 0:02:45.2]"
        },
        "variations": []
      },
      {
        "san": "Bg7",
        "move_number": 3,
        "color": "b",
        "lan": "f8g7",
        "annotations": {
          "comment": "[%clk 0:02:50.4]"
        },
        "variations": []
      },
      {
        "san": "Nc3",
        "move_number": 4,
        "color": "w",
        "lan": "b1c3",
        "annotations": {
          "comment": "[%clk 0:02:42.7]"
        },
        "variations": []
      },
      {
        "san": "Qa5",
        "move_number": 4,
        "color": "b",
        "lan": "d8a5",
        "annotations": {
          "comment": "[%clk 0:02:49.8]"
        },
        "variations": []
      },
      {
        "san": "Bd2",
        "move_number": 5,
        "color": "w",
        "lan": "c1d2",
        "annotations": {
          "comment": "[%clk 0:02:30.6]"
        },
        "variations": []
      },
      {
        "san": "Qxc5",
        "move_number": 5,
        "color": "b",
        "lan": "a5c5",
        "annotations": {
          "comment": "[%clk 0:02:49.7]"
        },
        "variations": []
      },
      {
        "san": "Nd5",
        "move_number": 6,
        "color": "w",
        "lan": "c3d5",
        "annotations": {
          "comment": "[%clk 0:02:29.1]"
        },
        "variations": []
      },
      {
        "san": "e6",
        "move_number": 6,
        "color": "b",
        "lan": "e7e6",
        "annotations": {
          "comment": "[%clk 0:02:42.5]"
        },
        "variations": []
      },
      {
        "san": "Bb4",
        "move_number": 7,
        "color": "w",
        "lan": "d2b4",
        "annotations": {
          "comment": "[%clk 0:02:28.1]"
        },
        "variations": []
      },
      {
        "san": "Qc6",
        "move_number": 7,
        "color": "b",
        "lan": "c5c6",
        "annotations": {
          "comment": "[%clk 0:02:36.6]"
        },
        "variations": []
      },
      {
        "san": "Bb5",
        "move_number": 8,
        "color": "w",
        "lan": "f1b5",
        "annotations": {
          "comment": "[%clk 0:02:26.8]"
        },
        "variations": []
      },
      {
        "san": "Qxb5",
        "move_number": 8,
        "color": "b",
        "lan": "c6b5",
        "annotations": {
          "comment": "[%clk 0:02:32.1]"
        },
        "variations": []
      },
      {
        "san": "Nc7+",
        "move_number": 9,
        "color": "w",
        "lan": "d5c7",
        "annotations": {
          "comment": "[%clk 0:02:25.7]"
        },
        "variations": []
      },
      {
        "san": "Kd8",
        "move_number": 9,
        "color": "b",
        "lan": "e8d8",
        "annotations": {
          "comment": "[%clk 0:02:32.8]"
        },
        "variations": []
      },
      {
        "san": "Nxb5",
        "move_number": 10,
        "color": "w",
        "lan": "c7b5",
        "annotations": {
          "comment": "[%clk 0:02:24.4]"
        },
        "variations": []
      }
    ],
    "notes": ""
  }
]